wav_filename,wav_filesize,transcript
common_voice_tr_21659627.wav,115244,hükümet satış için başka bir neden daha sunuyor
common_voice_tr_21659625.wav,116012,reform süreçlerinin hızından memnun musunuz
common_voice_tr_21659624.wav,99116,fakat ilerleme vakti geldi
common_voice_tr_21659640.wav,106028,otosansüre yaygın şekilde rastlanıyor
common_voice_tr_21659642.wav,118316,eğitime elbette daha fazla yatırım yapılmalı
common_voice_tr_21659665.wav,107564,fakat başkan suçlamayı reddediyor
common_voice_tr_21659650.wav,126764,tarihi binalar köprüler ve kaleler var
common_voice_tr_21659651.wav,119852,kentin sokakları iki metre su altında kaldı
common_voice_tr_21659667.wav,112172,hükümet eli kolu bağlı olduğunu ileri sürüyor
common_voice_tr_21659683.wav,110636,burada arkadaşlarım iyi adamlar var
common_voice_tr_21659649.wav,96044,tipik roman yüzü var bende
common_voice_tr_21659652.wav,66092,nerede
common_voice_tr_21659668.wav,124460,ancak ciddi engeller var olmaya devam ediyor
common_voice_tr_21659699.wav,117548,ancak gerçek oran kuskusuz daha yüksek
common_voice_tr_21659682.wav,94508,bu sırbistan'ın ilk maç günüydü
common_voice_tr_21659701.wav,116780,muhalefet partileri oylamayı boykot ettiler
common_voice_tr_21659715.wav,129836,ancak bölge bazı ciddi sorunlarla hala uğraşıyor
common_voice_tr_21659737.wav,121388,bu temel görevler büyük oranda yerine getirildi
common_voice_tr_21659738.wav,241196,ayrıca gerçek etnik köklerimizin arkasında saklanırsak önyargıyla nasıl savaşırız
common_voice_tr_21659718.wav,130604,bunda soğuk havanın da etkisi olmuş olabilir
common_voice_tr_21659736.wav,96044,fakat projenin önünde bazı engeller var
common_voice_tr_21659773.wav,120620,azınlıklara özel bir saygı gösterecektir
common_voice_tr_21659766.wav,159788,arnavutluk kırk ikinci makedonya ise yetmiş ikinci sırada
common_voice_tr_21659767.wav,111404,ancak o günü bütün ülkeler kutlamadı
common_voice_tr_21659775.wav,115244,ban ziyaret için kesin bir tarih vermedi
common_voice_tr_21659759.wav,123692,ancak bu olumlu durum kısa sürede tersine dondu
common_voice_tr_21659765.wav,129836,gönüllüler aynı zamanda islamci misyonerlerdi
common_voice_tr_21659770.wav,126764,bu hükümetin projeye ikinci destek verişi
common_voice_tr_21659771.wav,144428,bu toplumumuzdaki durumun bir yansıması idi
common_voice_tr_21659807.wav,96044,lego bu yıl elli yaşına bastı
common_voice_tr_21659787.wav,101420,müzakereler bir yıl önce başlatıldı
common_voice_tr_21659826.wav,117548,tahminen kaç gazeteci işten çıkarıldı
common_voice_tr_21659825.wav,99884,belge iki bin altı yılını kapsıyor
common_voice_tr_21659836.wav,116012,sırbistan'ın organ donörlerine ihtiyacı var
common_voice_tr_21659840.wav,116012,kokaini taşıyan tır makedon plakalıydı
common_voice_tr_21659860.wav,125996,ancak bayrak pekin'de biraz karışıklığa yol açtı
common_voice_tr_21659893.wav,117548,olanları öğrendikten sonra bile sessiz kaldım
common_voice_tr_21659892.wav,94508,bunda ne kadar ciddiler acaba
common_voice_tr_21659915.wav,105260,herşeyi barışçıl yollardan çözerdi
common_voice_tr_21659914.wav,135212,prag'ın baharı vardı belgrad'ın neden olmasın
common_voice_tr_21659946.wav,109100,aklını kullanmak zorunda kalarak büyümüş
common_voice_tr_21659948.wav,140588,çalışanlar kırk günden fazla süredir grev yapıyor
common_voice_tr_21659974.wav,112172,yemekler bayramın dini önemini yansıtıyor
common_voice_tr_21659978.wav,143660,mayıs iki bin beşte başkanlığı hırvatistan devralacak
common_voice_tr_21659953.wav,114476,projenin toplam bütçesi bir milyar avro
common_voice_tr_21659993.wav,108332,ancak değişikliklerden herkes memnun değil
common_voice_tr_21659979.wav,75308,bizim politikamız budur
common_voice_tr_21659976.wav,117548,bulgar yetkililer kararları hemen kınadılar
common_voice_tr_21659994.wav,117548,romanya'da faal durumda sadece otuz sinema var
common_voice_tr_21660008.wav,99884,adının açıklanmasını da istemiyor
common_voice_tr_21660011.wav,97580,bunun ilk adı dayanışma vergisiydi
common_voice_tr_21660007.wav,107564,üretime yıl sonunda başlanması planlanıyor
common_voice_tr_21660026.wav,140588,şansıma ve buradaki herkesin şansına bu olmadı
common_voice_tr_21660029.wav,96812,zihniyet değişimi eğitimle başlar
common_voice_tr_21660041.wav,79148,ne gibi faaliyetlerde bulunuyor
common_voice_tr_21660042.wav,109100,en az altmış kişi hayatını kaybetti
common_voice_tr_21660044.wav,106796,yine de fırsatlar kapısı açık görünüyor
common_voice_tr_21660040.wav,132140,yetkili şubat iki bin ona kadar bu görevde kalacak
common_voice_tr_21660045.wav,101420,yasalarla da başı belaya girdi
common_voice_tr_21660048.wav,115244,kararın kosova'daki yansımaları ne oldu
common_voice_tr_21660057.wav,119084,ama yenilmedik diz çökmedik ve ezilmedik
common_voice_tr_21660056.wav,109100,yarışmaya toplam on altı şarkıcı katıldı
common_voice_tr_21660055.wav,122156,bu vatandaşlar vizeleri için para ödemiyorlar
common_voice_tr_21660053.wav,99884,bu rakamlar belirgin şekilde artabilir
common_voice_tr_21660052.wav,65324,favori kim
common_voice_tr_21660062.wav,95276,artık çok kaliteli gazeteciler var
common_voice_tr_21660060.wav,121388,hafta sonu ülkeye elli santimetre daha kar yağdı
common_voice_tr_21660061.wav,119084,ama önce partinin seçimleri kazanması gerekiyor
common_voice_tr_21660063.wav,96044,rapor altı ekim'de yayınlanacak
common_voice_tr_21660058.wav,98348,kadın meclis üyelerinin sayısı da artıyor
common_voice_tr_21660081.wav,131372,ancak şimdi kasabada yalnızca bir sırp yaşıyor
common_voice_tr_21660082.wav,109100,ankete katılan başka balkan ülkesi yok
common_voice_tr_21660067.wav,103724,ben savaştan çıkmış bir ülkede büyüdüm
common_voice_tr_21660111.wav,84524,kazadan kurtulan olmadı
common_voice_tr_21660136.wav,135212,makedonya üyelik başvurusunu yirmi iki mart'ta sundu
common_voice_tr_21660138.wav,121388,sonuç olarak park için başka bir yer seçildi
common_voice_tr_21660137.wav,132908,pahor sonuçtan duyduğu memnuniyeti gizlemedi
common_voice_tr_21660135.wav,83756,makedonya bir
common_voice_tr_21660173.wav,137516,etkinlikte altmış ülkeden beş yüz karikatür yer alacak
common_voice_tr_21660174.wav,119084,sırplar pekin'de neden daha iyisini yapamadılar
common_voice_tr_21661539.wav,160556,medya toplumlar arası diyalogu ilerletmek için ne yapabilir
common_voice_tr_21660172.wav,95276,festivalde canlı müzik de vardı
common_voice_tr_21661540.wav,148268,takım üç sezondur şampiyonluğu elden bırakmıyor
common_voice_tr_21661574.wav,100652,bu deliği de tıkadılar
common_voice_tr_21661588.wav,110636,ayrı bir kapta şekerli suyu kaynatın
common_voice_tr_21661571.wav,145196,kelmendi'nin eşi makbule iyimser görüşe sahip
common_voice_tr_21661587.wav,70700,neden mi
common_voice_tr_21661582.wav,138284,özel ve kamu yatırımlarında azalmalar var
common_voice_tr_21661575.wav,132140,milletvekili dokunulmazlığı yirmi dört saattir
common_voice_tr_21661592.wav,140588,seçimler on dört nisan çarşamba günü yapılacak
common_voice_tr_21661621.wav,112940,elde edilen bilgiler halkı şok etti
common_voice_tr_21661590.wav,127532,planda itiraz ettiğiniz temel noktalar neler
common_voice_tr_21661619.wav,131372,aynı kural bakan yardımcıları için de geçerli
common_voice_tr_21661630.wav,108332,kurumlar vergisi de yüzde ona indirilecek
common_voice_tr_21661631.wav,110636,o muhteşem kişilikli marietta
common_voice_tr_21661628.wav,99884,şimdi tekrar mücadele ediyorlar
common_voice_tr_21661643.wav,120620,arsa yaklaşık yedi milyon avroya satılacak
common_voice_tr_21661652.wav,82220,bunlar en büyükleri
common_voice_tr_21661639.wav,140588,fikir dünyanın pek çok ülkesinde başarı kazandı
common_voice_tr_21661650.wav,129836,bir analist ayrıntılı bilgi istediğini belirtti
common_voice_tr_21661649.wav,122156,bağış anlaşması bir ağustos'ta imzalandı
common_voice_tr_21661661.wav,133676,hırvatistan golf dünyasında geride kalmıştı
common_voice_tr_21661646.wav,118316,vergi mevzuatı da bu alanlardan biri
common_voice_tr_21661669.wav,108332,bazı tanıklar ifade vermeyi reddetti
common_voice_tr_21661665.wav,102956,avro olmadan ülke parçalanır
common_voice_tr_21661666.wav,87596,çok uzun bir zamandır
common_voice_tr_21661667.wav,99116,ne demek istediklerini anlıyordum
common_voice_tr_21661668.wav,99116,kuruluş özelleştirmeye hazır
common_voice_tr_21661679.wav,167468,peki bu durumda kosova'nın ekonomisini düzeltme ihtimali nedir
common_voice_tr_21661681.wav,127532,bosna'ya dört yıl önce gittim ve çok sevdim
common_voice_tr_21661680.wav,107564,kosova hükümeti de sert tepki verdi
common_voice_tr_21661677.wav,106028,günümüzde avukat olmak zor
common_voice_tr_21661693.wav,119084,tava dolana kadar bu işleme devam edin
common_voice_tr_21661694.wav,145964,ali'nin özel polis timi üyesi olduğu söyleniyor
common_voice_tr_21661709.wav,162092,bu yılki fuarda yirmi beş binden fazla kitap tanıtıldı
common_voice_tr_18892509.wav,172844,hastalık dört yüz otuz bin hastada ileri seviyede
common_voice_tr_21661696.wav,112172,program özel amaçlar için kullanılmayacak
common_voice_tr_18892508.wav,149804,nuremberg'de de aynen böyle oldu
common_voice_tr_21661711.wav,147500,sırbistan'ın şu anki nüfusu yedi virgül üç milyon
common_voice_tr_18892524.wav,73004,bunu söylemek zor
common_voice_tr_18892525.wav,144428,ancak bunu uygulamak daha büyük bir sorun olacak
common_voice_tr_18892526.wav,129068,yemek alanı sokak lambalarıyla aydınlatıldı
common_voice_tr_18892522.wav,121388,ancak herkes aynı fikirde değil
common_voice_tr_18892521.wav,149804,çocuklar yerel kliniklerde aşı olabilecek
common_voice_tr_18892520.wav,113708,kamuoyu denktaş'a karşı
common_voice_tr_18892539.wav,117548,festival yirmi altı kasım'a kadar devam edecek
common_voice_tr_18892538.wav,103724,halkın büyük bölümü de aynı görüşte
common_voice_tr_18892535.wav,121388,böyle bir durumda çok fazla seçeneğiniz olmuyor
common_voice_tr_18892591.wav,98348,kitabı da bunun için yazdım zaten
common_voice_tr_18892544.wav,125228,drescher'in kendisi de rahim kanserini yenmişti
common_voice_tr_18892594.wav,113708,kongreye on yedi ülkeden katılımcılar katıldı
common_voice_tr_18892593.wav,107564,bizi bilgilendirmek zorunda değiller
common_voice_tr_18892600.wav,186668,kosova'da sizin için özel önemi olan bir yer yemek veya hikaye var mı
common_voice_tr_18892601.wav,157484,etkinlik bin dokuz yüz yetmiş iki yılından beri düzenleniyor
common_voice_tr_18892622.wav,86828,operasyon olaysız geçti
common_voice_tr_18892610.wav,107564,fikirler bol olsa da kaynaklar kısıtlı
common_voice_tr_18892613.wav,99884,siyasi istikrar da bunda rol oynadı
common_voice_tr_18892619.wav,115244,pek çok vatandaş bu hamle konusunda hevesli
common_voice_tr_18892616.wav,129068,sanader de günün anlam ve önemine dikkat çekti
common_voice_tr_18892614.wav,145964,bitiki de bağlantının net olmadığına katılıyor
common_voice_tr_18892611.wav,136748,ülkenin latin alfabesindeki alan adı ise bg
common_voice_tr_18892617.wav,134444,bu noktada kültürler arasında bir savaş olduğunu söyleyebilir miyiz
common_voice_tr_18892637.wav,115244,etkinliğin ana konusu kategori teorisiydi
common_voice_tr_18892636.wav,125228,fon modernizasyonun finansmanında kullanılacak
common_voice_tr_18892627.wav,119084,ancak geçmişe değil geleceğe bakma zamanı
common_voice_tr_18892639.wav,90668,bizim kendimize bakmamız lazımdır
common_voice_tr_18895846.wav,117548,balkanlar'da da bu daha az geçerli değil
common_voice_tr_18895844.wav,145964,bute maçı onuncu rauntta nakavtla kazandı
common_voice_tr_18895855.wav,67628,yapılacak çok şey var
common_voice_tr_18895858.wav,88364,ardından hamuru iki parçaya bölün
common_voice_tr_18895863.wav,115244,mladiç iki bin yılından beri kanundan kaçıyor
common_voice_tr_18895860.wav,86828,bunda başarı sağlandı gibi de görünüyor
common_voice_tr_18895854.wav,102188,boskovski tüm suçlamaları reddetti
common_voice_tr_18895867.wav,88364,makedon hükümeti öneriyi reddetti
common_voice_tr_18895880.wav,103724,çok sıfırlı rakamlar kafa karıştırıcı olabiliyor
common_voice_tr_18895879.wav,99884,turistlerin büyük kısmı kosova'dan geliyor
common_voice_tr_18895862.wav,86828,şimdi tekrar mücadele ediyorlar
common_voice_tr_18895874.wav,172844,ayrıca gerçek etnik köklerimizin arkasında saklanırsak önyargıyla nasıl savaşırız
common_voice_tr_18895861.wav,73004,uzlaşmak istemiyorlar
common_voice_tr_18895885.wav,122924,sc parayı üç ila dört ay içinde almayı umuyor
common_voice_tr_18895888.wav,107564,yunanistan'da hayat artık çok zorlaşmıştı
common_voice_tr_18895891.wav,109868,genelde yolcular gelişmelerden heyecan duruyor
common_voice_tr_18895886.wav,99884,bir diğer engel de tasfiye sürecinin yavaşlığı
common_voice_tr_18895901.wav,73004,oyun alanı sadece bir örnek
common_voice_tr_18895890.wav,82988,o yüzden sakın umudunuzu kaybetmeyin
common_voice_tr_18895904.wav,113708,bankadan alınacak yardım üç alanda yoğunlaşacak
common_voice_tr_18895884.wav,125228,ancak bayrak pekin'de biraz karışıklığa yol açtı
common_voice_tr_18895918.wav,92204,anlaşmanın ekonomik faydaları büyük olacak
common_voice_tr_18895906.wav,79148,ama bu amacına da ulaşamadı
common_voice_tr_18895926.wav,106028,tatbikatta yaklaşık bin beş yüz asker görev aldı
common_voice_tr_18895919.wav,63788,yine de seçenekler var
common_voice_tr_18895915.wav,82988,madenciler de talep düşüşü yaşıyorlar
common_voice_tr_18895933.wav,96044,vlasiç sporcu bir ailenin en büyük çocuğu
common_voice_tr_18895914.wav,84524,tek sorun rekabetin giderek artması
common_voice_tr_18895924.wav,136748,fakat bu dönüşüm nasıl gerçekleşebilir bu açmazdan nasıl çıkılabilir
common_voice_tr_18895943.wav,106028,egmont grubu bu meselelere nasıl yaklaşıyor
common_voice_tr_18895934.wav,99884,sürecin bu sonbaharda başlaması bekleniyor
common_voice_tr_18895941.wav,92204,bizim ülkemizdeyse tam tersi şekilde başladı
common_voice_tr_18895938.wav,80684,fehmiu yetmiş dört yaşındaydı
common_voice_tr_18895947.wav,88364,boskovski bağımsız aday olarak yarışıyor
common_voice_tr_18895950.wav,94508,proje gelecek yılın sonuna kadar uygulanacak
common_voice_tr_18895964.wav,144428,bunun kosova'nın tamamını etkileyebilecek bir güvenlik meselesi olarak önemi nedir
common_voice_tr_18895969.wav,103724,tasarının şu anki halinde kırk dört madde yer alıyor
common_voice_tr_18895968.wav,99884,teklif verme süresi altı kasım'da sona ediyor
common_voice_tr_18895974.wav,71468,görünüşe göre para sorun değil
common_voice_tr_18895978.wav,79148,geçen yılki rekor rusya'ya aitti
common_voice_tr_18895975.wav,73004,kendimizi yenilmiş hissetmiyoruz
common_voice_tr_18895972.wav,82988,yetersiz ve yeterli olduğu noktalar neler
common_voice_tr_18895990.wav,115244,romanya'nın yüzde sıfır virgül beşlik düşüş kaydetmesi bekleniyor
common_voice_tr_18895995.wav,126764,dementieva maçı yedi altı ve üç sıfır önde götürüyordu
common_voice_tr_18895992.wav,75308,bence olmama olasılığı oldukça yüksek
common_voice_tr_18896000.wav,106028,ancak vuciniç'e göre bu suçlamalar asılsız
common_voice_tr_18896010.wav,73004,bu da cuma günü gerçekleşti
common_voice_tr_18896011.wav,76844,etkinlik yirmi iki ekim'de sona erecek
common_voice_tr_18896012.wav,86828,üst yönetim seviyesinde fark daha da büyük
common_voice_tr_18896019.wav,96044,drugclan aynı fikirde değil
common_voice_tr_18896025.wav,115244,benedikt ile yaptığı görüşme sonrasında geldi
common_voice_tr_18896021.wav,86828,birlik şu anda altı bin askere sahip
common_voice_tr_18896022.wav,125228,yaşamak istiyorum rukavina'nın mektubunun ilk satırıydı
common_voice_tr_18896030.wav,84524,hırvat heyetinin gezisi bir hafta sürecek
common_voice_tr_18896029.wav,192044,silajdziç ve dodik'i bu tavırlarını değiştirmeleri yönünde ikna etmek için neler yapılabilir
common_voice_tr_18896031.wav,144428,yoksa sadece bir hayalpereset ve sahte bilimadamının uydurduğu bir yanılsama mı
common_voice_tr_18896027.wav,99884,fakat yasayı değiştirmekle herşey hallolmuyor
common_voice_tr_18896028.wav,88364,sergi yedi nisan'a kadar açık kalacak
common_voice_tr_18896026.wav,106028,bunu sessizliğin kalitesinden anlıyorsunuz
common_voice_tr_18896009.wav,84524,bunlara bile geçici çalışma izni verilecek
common_voice_tr_18895994.wav,98348,peki bu sorunlarla başa çıkma şansımız nedir
common_voice_tr_18895927.wav,92204,elbette ki her duyduğunuza inanamazsınız
common_voice_tr_19452694.wav,76844,hukukun üstünlüğü
common_voice_tr_19452695.wav,129068,ödül hayatınızda ne gibi değişiklikler yarattı
common_voice_tr_19452696.wav,113708,bu temel görevler büyük oranda yerine getirildi
common_voice_tr_19452700.wav,117548,türkiye yönetim sistemini elden geçiriyor
common_voice_tr_19452710.wav,113708,ne ki üyelik imkansız bir hayal değil
common_voice_tr_19452718.wav,115244,yeni fiyatlar gelecek ay yürürlüğe girecek
common_voice_tr_19452708.wav,90668,bu programlardaki durumlar sahte
common_voice_tr_19452725.wav,111404,jonuz kısa süreli görevi kabul eden tek adaydı
common_voice_tr_19452724.wav,130604,uzun tatiller bulgar işletmelerine pahalıya mı mal oluyor
common_voice_tr_19452728.wav,106028,etkinlik avrupa sinemasını tanıtıyor
common_voice_tr_19452739.wav,111404,bu düşüş de yine işten çıkarma anlamına gelecek
common_voice_tr_19452751.wav,94508,olayların failleri bulunamadı
common_voice_tr_19452749.wav,117548,kosova'nın tanınma sürecinde yavaşlama mı yaşanıyor
common_voice_tr_19452741.wav,109868,neredeyse dört yüz kişi aleyhinde dava açıldı
common_voice_tr_19452752.wav,117548,ancak makedonya'nın yapması gereken işler var
common_voice_tr_19452754.wav,107564,katılım yaklaşık yüzde yetmiş oranında gerçekleşti
common_voice_tr_19452763.wav,94508,burada dikkati çeken ilk şey mimari
common_voice_tr_19452756.wav,115244,ancak zanlı savaş suçu işlediğini reddetti
common_voice_tr_19452770.wav,88364,bizde ise halen böyle bir merkez yok
common_voice_tr_19452777.wav,111404,ankete toplam bin yüz on beş kişi katıldı
common_voice_tr_19452769.wav,121388,misyonun bir parçası olmaktan gurur duyuyorum
common_voice_tr_19452780.wav,113708,dava büyük olasılıkla hırvatistan'da görülecek
common_voice_tr_19452779.wav,136748,mayıs iki bin beşte başkanlığı hırvatistan devralacak
common_voice_tr_19452791.wav,167468,gösterge faiz oranı yüzde altıdan yüzde beş virgül yetmiş beşe düşürüldü
common_voice_tr_19452795.wav,134444,ancak lefkoşe öneriyi kesin bir dille reddetti
common_voice_tr_19452781.wav,106028,polis olayı bir suikast girişimi olarak niteledi
common_voice_tr_19452801.wav,63788,bu haberler doğru mu
common_voice_tr_19452797.wav,96044,bana hiçbir yeni öneri getirilmedi
common_voice_tr_19452812.wav,136748,sıcaklar dayanılmaz hale geldiğinde onlar nereye gidiyor
common_voice_tr_19452799.wav,94508,yunan yetkililer anlaşmayı benimsediler
common_voice_tr_19452810.wav,107564,birliğin ülkede iki ay kalacağı bildirildi
common_voice_tr_19452847.wav,113708,costi rogozanu meseleyi küçümsüyor
common_voice_tr_19452850.wav,190508,türkiye kaddafi'ye karşı görüşlerini daha güçlü bir şekilde dile getirmekte neden tereddüt ediyor
common_voice_tr_19452869.wav,88364,bunun dışındaki her şey spekülasyondur
common_voice_tr_19452867.wav,84524,olayla ilgili bir tutuklama yapılmadı
common_voice_tr_19452872.wav,92204,türk medyası da yasağa ateş püskürdü
common_voice_tr_19452873.wav,103724,katılım oranı yaklaşık yüzde kırk yedi idi
common_voice_tr_19452883.wav,102188,ancak faillerin kimlikleri belirlenemedi
common_voice_tr_19452882.wav,107564,sahnede çalışırken hep birlikte gülüp eğlenmemiz
common_voice_tr_19452887.wav,111404,yaklaşık kırk milyon seçmen sandık başına gitti
common_voice_tr_19452889.wav,122924,ekonomik ya da daha farklı engellemeler olmasını bekliyor musunuz
common_voice_tr_19452891.wav,98348,son olaylar endişe seviyesini yükseltti
common_voice_tr_19452894.wav,159788,belgrad ve lahey arasındaki işbirliği konusunda ne düşünüyorsunuz
common_voice_tr_19452909.wav,96044,hırvatistan golf dünyasında geride kalmıştı
common_voice_tr_19452905.wav,102188,sonuç olarak ashdown müdahale etti
common_voice_tr_19452906.wav,84524,yıldız da duyduğu güveni dile getirdi
common_voice_tr_19452929.wav,90668,sokaktaysa vatandaş sonuç bekliyor
common_voice_tr_19452932.wav,125228,brüksel adresli bu mektuplu protesto ne gibi bir etki yarattı
common_voice_tr_19452928.wav,80684,kurumlar vergisi de yüzde ona indirilecek
common_voice_tr_19452927.wav,111404,sibiu'nun kendine has bir ortaçağ havası var
common_voice_tr_19452926.wav,75308,aslında böyle bir şey yok
common_voice_tr_19452933.wav,96044,yeni anayasanın onaylamasına çalışılacak
common_voice_tr_19452937.wav,65324,herşeyi kendim yaptım
common_voice_tr_19452936.wav,92204,tek sorun yatırım ve zaman kaybı da değil
common_voice_tr_19452914.wav,73004,ancak bu sadece son bölümdü
common_voice_tr_19452965.wav,99884,ödül için tüm dünyadan seksen film yarıştı
common_voice_tr_19452940.wav,92204,öncelikle karşılıklı güven sağlanmalı
common_voice_tr_19452962.wav,117548,peki eğitim devlet okullarından verilen eğitimden daha mı iyi
common_voice_tr_19452966.wav,75308,fakat artık bu durum değişti
common_voice_tr_19452969.wav,107564,bu her ikimiz için de tuhaf bir deneyim oldu
common_voice_tr_19452958.wav,102188,şeffaflık eksikliği bunu anlamayı zorlaştırıyor
common_voice_tr_19452970.wav,138284,rodos'a gidiş dönüş biletiyse adam başı iki yüz elli avro
common_voice_tr_19452998.wav,106028,tabii bin dokuz yüz doksanlardan bu yana durum değişti
common_voice_tr_19452968.wav,121388,fakat artık isim ikincil bir rol alıyor
common_voice_tr_19453001.wav,88364,geliştirme süreci zaten başlamış durumda
common_voice_tr_19452999.wav,56108,bu konuda bir ikilem yok
common_voice_tr_19453012.wav,145964,bu katı bilişsel uyumsuzluğun arkasında yatan etmenler nedir
common_voice_tr_19453014.wav,96044,genişleme coğrafi açıdan da önem taşıyor
common_voice_tr_19453005.wav,140588,peki yeni bir karışıklığın kapıda olduğunu gösteren işaretler var mı
common_voice_tr_19453018.wav,82988,pahor bu hareketi eleştirdi
common_voice_tr_19453030.wav,96044,ekim ayında bir ilerleme raporu yayınlanacak
common_voice_tr_19453017.wav,102188,tasarı yüksek mahkeme tarafından da reddedildi
common_voice_tr_19453028.wav,84524,bakan şu ana kadar bir yorum yapmadı
common_voice_tr_19453036.wav,86828,diplomasi sabır ve zaman ister
common_voice_tr_19453043.wav,88364,bu konudaki yorumlarınız neler olacaktır
common_voice_tr_19453037.wav,88364,onlara komünist sistemi anlattı
common_voice_tr_19453042.wav,106028,ülkede iki bin iki yüz elli altı sandık merkezi olacak
common_voice_tr_19453049.wav,90668,türkiye tutuklamaları memnuniyetle karşıladı
common_voice_tr_19453061.wav,79148,belge ekim ayında yürürlüğe girecek
common_voice_tr_19453062.wav,56108,çok gerçekçi
common_voice_tr_19453064.wav,103724,mekanlardan birinde polis uyuşturucu da buldu
common_voice_tr_19453066.wav,130604,sırp ordusu ihtilafı önlemek için nasıl tepki gösterecektir
common_voice_tr_19453068.wav,86828,onun sadece işini yaptığını biliyorlardı
common_voice_tr_19453069.wav,76844,şu anda mecliste oylanmayı bekliyor
common_voice_tr_19453063.wav,75308,proje yedi yüz milyon avro tutacak
common_voice_tr_19453071.wav,61484,şenlikler üç gün sürüyor
common_voice_tr_19453080.wav,113708,bunların otuz iki milyonu slovenya üzerinden geldi
common_voice_tr_19453091.wav,98348,resimler mart ayı sonuna kadar sergide kalacak
common_voice_tr_19453088.wav,92204,bunun üzerindeki miktarlar vergiye tabi olacak
common_voice_tr_19453083.wav,79148,bu da son derece gurur duyduğum bir şey
common_voice_tr_19453093.wav,125228,krstiç şu anda kırk altı yıllık hapis cezasını çekmekte
common_voice_tr_19453095.wav,163628,bir kasabanın yarısını boşaltmak zorunda kalırsanız bu kadar insanı nereye taşıyacaksınız
common_voice_tr_19453099.wav,111404,buna karşın arnavutluk'ta asgari ücret yüz kırk iki avro
common_voice_tr_19453101.wav,75308,zirve iki yılda bir düzenleniyor
common_voice_tr_19453130.wav,96044,üçlü bir ekim seçimlerinden galip çıkmıştı
common_voice_tr_19453105.wav,106028,mevcut ortam bir tür balon olarak tanımlanabilir mi
common_voice_tr_19453103.wav,96044,yıl sonuna kadar kıbrıs'ta çözüm mümkün mü
common_voice_tr_19453113.wav,80684,alıcının adı kasım ayında duyurulacak
common_voice_tr_19453123.wav,111404,toplam yatırım bedeli altı virgül beş milyon avroya ulaştı
common_voice_tr_19453122.wav,109868,si bu kararıyla iddiayı kaybetmiş göründü
common_voice_tr_19453118.wav,115244,aynı rakam iki bin iki yılında yüzde dokuz virgül altı idi
common_voice_tr_19453114.wav,79148,etkinlik yirmi sekiz ekim'de sona erecek
common_voice_tr_19453120.wav,90668,parlamento bu yasal çarkı destekliyor
common_voice_tr_19453139.wav,106028,hükümet şirketin yüzde yirmi beşini elinde tutmak istiyor
