wav_filename,wav_filesize,transcript
common_voice_tr_18237940.wav,199724,bu başarının sırrı ne sırp halkını klasik müziğe nasıl yakınlaştırdınız
common_voice_tr_18237947.wav,111404,türk liderlerin on altı
common_voice_tr_18237955.wav,106028,vesiç birkaç örnek daha veriyor
common_voice_tr_18237954.wav,126764,beyin göçü hırvatistan'da kalkınmayı baltalıyor
common_voice_tr_18237958.wav,111404,yunan takımı rusya'yı on üç on yendi
common_voice_tr_18237957.wav,96044,yaşları on dört on beş ve on altı idi
common_voice_tr_18238011.wav,125228,fakat bütün siyasiler bu kadar şanslı değildi
common_voice_tr_18238009.wav,119084,son derece uluslararası bir zihniyetteler
common_voice_tr_18238016.wav,107564,proje yedi yüz milyon avro tutacak
common_voice_tr_18238015.wav,111404,ancak yeni yasa herkese uygulanmayacak
common_voice_tr_18238017.wav,99884,komşu kosova'da da durum aynı
common_voice_tr_18238014.wav,79148,ama bu olmadı
common_voice_tr_21287864.wav,188204,bizlere görevinizi açıklayabilir misiniz
common_voice_tr_21287863.wav,230444,fakat iş arayanların hepsi ikna olmuş değil
common_voice_tr_21287892.wav,217388,kosova'da sizin için özel önemi olan bir yer yemek veya hikaye var mı
common_voice_tr_21287901.wav,119084,podujevo tek örnek değil
common_voice_tr_21287894.wav,138284,bunun üzerine gaşi ateş açtı
common_voice_tr_21287890.wav,149804,konut ve eğitim en önemli alanlar
common_voice_tr_21287899.wav,172844,ödül için tüm dünyadan seksen film yarıştı
common_voice_tr_21287900.wav,165164,makedonya'nın iyi bir ev sahipliği yaptığını düşünüyor musunuz
common_voice_tr_21287896.wav,130604,kuruluş özelleştirmeye hazır
common_voice_tr_21287893.wav,169004,anayasaya göre arnavutluk'un resmi bir dini yok
common_voice_tr_21287912.wav,115244,fiyatlar çok yüksekti
common_voice_tr_21287928.wav,122924,bakan şu ana kadar bir yorum yapmadı
common_voice_tr_21287927.wav,165164,özellikle de genç kızlar size bayılıyor
common_voice_tr_21288244.wav,159788,amerika'da çok çeşitli filmler var
common_voice_tr_21288256.wav,144428,çok sayıda blogcu da duruma ağırlığını koydu
common_voice_tr_21288258.wav,129068,önemli ekonomik faktörler de söz konusu
common_voice_tr_21288249.wav,92204,uzlaşmak istemiyorlar
common_voice_tr_21288314.wav,130604,pek çok vatandaş bu hamle konusunda hevesli
common_voice_tr_21288281.wav,203564,kirin gerçekten soruşturma başlattıysa bunu yapma yetkisini nereden aldı
common_voice_tr_21288333.wav,126764,ve tabii ki banyoda kaçak var
common_voice_tr_21288330.wav,75308,bu imkansız
common_voice_tr_21288332.wav,138284,o muhteşem kişilikli marietta
common_voice_tr_21288317.wav,163628,ancak lefkoşe öneriyi kesin bir dille reddetti
common_voice_tr_21288316.wav,157484,erteleme ekonominin düzelmesini sağlamayacaktır
common_voice_tr_21288303.wav,138284,soruşturma geçen yıl başlatılmıştı
common_voice_tr_21288377.wav,148268,fakat stojarova'nın başka bir önerisi var
common_voice_tr_21288375.wav,142124,yeni fiyatlar gelecek ay yürürlüğe girecek
common_voice_tr_21288393.wav,138284,eski liderin cezaya itiraz etme hakkı var
common_voice_tr_21288414.wav,140588,sırbistan'daki karadağlılar buna katılıyorlar
common_voice_tr_21288403.wav,132908,pahor bu hareketi eleştirdi
common_voice_tr_21288399.wav,202028,belgrad ve lahey arasındaki işbirliği konusunda ne düşünüyorsunuz
common_voice_tr_21288418.wav,163628,costi rogozanu meseleyi küçümsüyor
common_voice_tr_21288412.wav,157484,ancak bu mahkeme sadece danışmanlık rolüne sahip
common_voice_tr_21288419.wav,149804,etkinliğin ana konusu kategori teorisiydi
common_voice_tr_21288437.wav,111404,kyriakou görev için tek adaydı
common_voice_tr_21288449.wav,218924,selin kontrol edilememesi ihtimali hakkındaki fikri sorulan cumhurbaşkanı allah korusun dedi
common_voice_tr_21288448.wav,215084,bunun kosova'nın tamamını etkileyebilecek bir güvenlik meselesi olarak önemi nedir
common_voice_tr_19104250.wav,166700,romanya'da faal durumda sadece otuz sinema var
common_voice_tr_19104259.wav,145196,ancak bedel çok daha yüksek olabilir
common_voice_tr_19104265.wav,132908,ancak bu durum son yıllarda değişiyor
common_voice_tr_19104267.wav,143660,son yıllarda belgrad önemli bir gelişim geçirdi
common_voice_tr_19104261.wav,167468,ordu bin dokuz yüz altmıştan bu yana dört hükümet devirdi
common_voice_tr_19104263.wav,111404,bu avrupa'ya uzanan bir yol
common_voice_tr_19104264.wav,160556,eğitim bu toplum için hayati önem taşıyor
common_voice_tr_19104268.wav,152876,anlaşmadan en az iki büyük fayda bekleniyor
common_voice_tr_19104273.wav,164396,bir diğer on altı bin altı yüz altmış iki kişi ise halen kayıp
common_voice_tr_19104270.wav,121388,olayda çevre evler de hasar gördü
common_voice_tr_19104289.wav,123692,duruşma on bir ekim'de yapılacak
common_voice_tr_19104297.wav,104492,ziyaretin amacı neydi
common_voice_tr_19104279.wav,145196,ayrıca basın enformasyonundan da sorumluydu
common_voice_tr_19104296.wav,155180,güvenilirlik ve şeffaflık olmazsa olmazlardan
common_voice_tr_19104298.wav,135212,şimdi bu önerilerin somutlaştırılması gerekiyor
common_voice_tr_19104305.wav,132140,ancak bu seçimlerin ikinci turu olmayacak
common_voice_tr_19104307.wav,132908,kıbrıs rum takımı bu yıl turnuvaya katılmayacak
common_voice_tr_19104328.wav,129836,fabrikanın bir yıl içinde açılması bekleniyor
common_voice_tr_19104308.wav,108332,dağa tırmanmaya devam ettik
common_voice_tr_19104310.wav,174380,aynı rakam iki bin iki yılında yüzde dokuz virgül altı idi
common_voice_tr_19104318.wav,135980,çocuklar hangi kategoriyi tercih ediyorlar
common_voice_tr_19104313.wav,115244,sizin bu çözümdeki rolünüz ne olur
common_voice_tr_19104325.wav,88364,bu kadarla da kalmadı
common_voice_tr_19104327.wav,122924,hareketle ilgili tartışmalar da çıkmadı değil
common_voice_tr_19104335.wav,119852,görüntü tıpkı bir sirki andırıyor
common_voice_tr_19104343.wav,170540,mevcut durum bu tür bir güce ihtiyaç duyulmayacak kadar güvenli mi
common_voice_tr_19104341.wav,129836,oda köşedeki televizyon dışında sessiz
common_voice_tr_19104336.wav,163628,asıl geçişse aralık bin dokuz yüz doksan yedide gerçekleşti
common_voice_tr_19104339.wav,143660,sizce bu görüşmeler bir sonuca bağlanacak mı
common_voice_tr_19104340.wav,130604,ancak bu hedefi tutturmak biraz zor oldu
common_voice_tr_19104337.wav,139052,bu fazlanın bu yıl daha da artması bekleniyor
common_voice_tr_19104346.wav,162860,uiki bin dokuz yüz doksan yedi yılında saraybosna'da çaldı
common_voice_tr_19104344.wav,106028,sekiz yıldır iktidardaydı
common_voice_tr_19104345.wav,120620,makroekonomik durum tekin kabul ediliyor
common_voice_tr_19104347.wav,128300,bu kararda çeşitli faktörler rol oynadı
common_voice_tr_19104357.wav,97580,savunma en güçlü unsur
common_voice_tr_19104379.wav,135212,yurtta da bütün çocuklara kapısını açtı
common_voice_tr_19104369.wav,109100,sporcuların antrenörleri de soruşturulacak
common_voice_tr_19104367.wav,93740,oyunla ilgili son gelişmeler nedir
common_voice_tr_19104380.wav,143660,toplam bin iki yüz civarında test yapılması bekleniyor
common_voice_tr_19104409.wav,207404,morrisey sonunda birileri şarkılarımın sözlerini biliyor diye bağırdı
common_voice_tr_19104383.wav,165932,yaklaşık kırk milyon seçmen sandık başına gitti
common_voice_tr_19104365.wav,81452,ardından saçı kesiliyor
common_voice_tr_19104390.wav,134444,peki söz konusu beklentiler gerçekçi mi
common_voice_tr_19104389.wav,124460,kosova avrupa'nın en genç nüfusuna sahip
common_voice_tr_19104393.wav,132908,vadi'deki evler taş ahşap ya da kerpiç
common_voice_tr_19104392.wav,133676,bugün goralılar üç ayrı ülkeye dağılmış durumda
common_voice_tr_19104398.wav,136748,alproud yaygın bir görüşü toparlıyor
common_voice_tr_19104412.wav,137516,bu göz yumulamayacak kadar ciddi bir sonuç
common_voice_tr_19104410.wav,119852,sonunda bütün suçlamalar düşürüldü
common_voice_tr_18379765.wav,163628,kampanya haziran iki bin ona kadar devam edecek
common_voice_tr_18379758.wav,136748,tuzla çeşitli ödüller almış bir şehir
common_voice_tr_18379780.wav,113708,onları yenmek çok önemli olacak
common_voice_tr_18379772.wav,169004,türkiye'de toplam yirmi sekiz ulusal gazete bulunuyor
common_voice_tr_18379852.wav,130604,limaj'a bir ay ev hapsi verildi
common_voice_tr_18379899.wav,126764,nuremberg'de de aynen böyle oldu
common_voice_tr_18379933.wav,129068,fakat sonuçlar tatsızdı
common_voice_tr_18379939.wav,122924,bence bu tarz şeylere açık olmanız gerekiyor
common_voice_tr_18379936.wav,130604,popov neden diye soruyor
common_voice_tr_17793267.wav,192044,dişil mesleki unvanların gelişi sırbistan'da kadınlara daha fazla eşitlik sağlayacak mı
common_voice_tr_17793266.wav,96044,aklını kullanmak zorunda kalarak büyümüş
common_voice_tr_17793264.wav,238124,projenin bedeli iki milyar avro olarak açıklandı
common_voice_tr_19205839.wav,94508,seçimlerde on aday yarışacak
common_voice_tr_19205838.wav,157484,ancak bayrak pekin'de biraz karışıklığa yol açtı
common_voice_tr_19205840.wav,117548,ab misyonu her taraftan baskı altında
common_voice_tr_19205830.wav,111404,blogcular da tam bundan bahsetmek istiyor
common_voice_tr_19205835.wav,130604,kararlı fakat dayatmasız tavrı öfkesini gizliyor
common_voice_tr_19205833.wav,111404,muhalefet partileri oylamayı boykot ettiler
common_voice_tr_19205845.wav,148268,gümrük idaresi beş yüz yetmiş iki virgül iki milyon avro topladı
common_voice_tr_19205855.wav,102188,bir koridorla da hastane bölümüne bağlanıyor
common_voice_tr_19205852.wav,130604,aşağı trend bu yılın ilk üç ayında da devam etti
common_voice_tr_19205856.wav,122924,oyuncu milli takımla elli beş karşılaşmaya çıkmıştı
common_voice_tr_19205860.wav,115244,peki bu jeolojik hareketliliğin sebebi ne
common_voice_tr_19205859.wav,119084,vadi'deki evler taş ahşap ya da kerpiç
common_voice_tr_19205853.wav,126764,katılım yaklaşık yüzde yetmiş oranında gerçekleşti
common_voice_tr_19205858.wav,98348,benim kuşağım kayıp bir kuşak oldu
common_voice_tr_19205862.wav,103724,malların bir kısmı almanya'ya ulaştı
common_voice_tr_19205873.wav,130604,ülke yerinde politikalar uyguluyor
common_voice_tr_19205861.wav,80684,bunda ne kadar ciddiler acaba
common_voice_tr_20969892.wav,108332,parlamento bu yasal çarkı destekliyor
common_voice_tr_20969888.wav,73004,fakat tek yön bu değildir
common_voice_tr_20969890.wav,129068,hafta sonu ülkeye elli santimetre daha kar yağdı
common_voice_tr_20969909.wav,124460,yaklaşık yüz elli dört rad taraftarı tutuklandı
common_voice_tr_20969911.wav,154412,kazı çalışmaları iki bin beş başına kadar sürecek
common_voice_tr_20969908.wav,111404,kosova'nın kuzeyini kim kontrol ediyor
common_voice_tr_20969926.wav,114476,munter'in görev süresi gelecek yaz sona erecekti
common_voice_tr_20969940.wav,86060,zagreb bunu değiştirmek istiyor
common_voice_tr_20969927.wav,165164,bu koşullar altında çalışanların özverili olmasını beklemek akıllıca bir şey mi
common_voice_tr_20969939.wav,159788,bu rakamın yüzde kırk altı virgül yetmiş dokuzunu kadınlar oluşturuyor
common_voice_tr_20969924.wav,119084,seyircinin yüzde kırkı yabancılardan oluşuyordu
common_voice_tr_20969954.wav,127532,genelde yolcular gelişmelerden heyecan duruyor
common_voice_tr_20969957.wav,96044,şehir merkezinde fırıncılık yapıyor
common_voice_tr_20969942.wav,135212,uzun tatiller bulgar işletmelerine pahalıya mı mal oluyor
common_voice_tr_20969966.wav,119084,fakat ülkede yeni yıl için pek heves duyulmuyor
common_voice_tr_20969963.wav,85292,bazıları şimdiden başarıya ulaştı
common_voice_tr_20969964.wav,91436,daha iyi bir hayat düşünülemezdi
common_voice_tr_20969980.wav,114476,projenin sonuçları nisan ayında yayınlandı
common_voice_tr_20969981.wav,103724,krizin tam etkisi hala ölçülemedi
common_voice_tr_20969978.wav,118316,ebeveynler derneğin var olmasından memnunlar
common_voice_tr_20969998.wav,96044,ancak bu insanlar inançları yüzünden öldürüldü
common_voice_tr_20970000.wav,121388,bu yıl bir otuzuncu yıldönümüne de sahne olacak
common_voice_tr_20969999.wav,83756,proje iki bin yedi başlarında başlayacak
common_voice_tr_20970002.wav,97580,sizin deyiminizle signomi
common_voice_tr_20970019.wav,77612,turnuva pazar günü sona eriyor
common_voice_tr_20970024.wav,124460,yeni tesisin yıllık kapasitesi sekiz virgül beş kilowatt saat olacak
common_voice_tr_18351504.wav,195884,merkezin iki bin on iki yılında açılması planlanıyor
common_voice_tr_18351503.wav,149804,kotooshu unvanı on üç birlik skorla kazandı
common_voice_tr_20970025.wav,92204,paylaşma ve yoksullara yardım etme zamanıdır
common_voice_tr_18351511.wav,119084,tek istisna ise vize serbestliği konusu oldu
common_voice_tr_18351505.wav,203564,bölgede geleceğe yönelik özelleştirme çalışmaları açısından daha neler yapılması gerekiyor
common_voice_tr_18351519.wav,115244,dava büyük olasılıkla hırvatistan'da görülecek
common_voice_tr_18351507.wav,140588,mesele türkiye'de oldukça hassas bir sorun
common_voice_tr_18351518.wav,90668,lükse yer kalmıyor
common_voice_tr_18351549.wav,92204,fakat sonuçlar tatsızdı
common_voice_tr_18351559.wav,121388,bölgesel işbirliği için iyi bir gerekçe vardır
common_voice_tr_18351557.wav,111404,otosansüre yaygın şekilde rastlanıyor
common_voice_tr_18351554.wav,98348,orada hayat farklı
common_voice_tr_18351577.wav,98348,adının açıklanmasını da istemiyor
common_voice_tr_18351578.wav,119084,şirket haftada üç sefer yapmayı planlıyor
common_voice_tr_18351690.wav,119084,belgrad bu son hayal kırıklığını hafife alıyor
common_voice_tr_18351763.wav,82988,bu şüphelere ne yanıt veriyorsunuz
common_voice_tr_18351743.wav,153644,yoksa tek gerçekçi ihtimal huzursuz bir şekilde birarada yaşamak mı
common_voice_tr_18351744.wav,94508,bunun dışındaki her şey spekülasyondur
common_voice_tr_18351762.wav,106028,ancak bunu uygulamak daha büyük bir sorun olacak
common_voice_tr_18351766.wav,103724,festival beş ağustos'a kadar devam edecek
common_voice_tr_18351777.wav,107564,bu yıl da bir tane düzenlenmesi planlanıyor
common_voice_tr_18351723.wav,109868,bu açıdan sağlık alanında belirsiz bir fark var
common_voice_tr_18351764.wav,117548,jonuz kısa süreli görevi kabul eden tek adaydı
common_voice_tr_18351780.wav,94508,şimdiki oran yüzde elli iki
common_voice_tr_18351812.wav,142124,makedonya bu yıl otuz adet t yetmiş iki tankı aldı
common_voice_tr_18351799.wav,94508,yumurta aklarını şekerle karıştırın
common_voice_tr_18351797.wav,138284,fuarda on beş ülkeden bin sekiz yüz katılımcı bir araya geldi
common_voice_tr_18351814.wav,99884,dink'in ölümünün etkisi ne oldu
common_voice_tr_18351816.wav,102188,elde edilen bilgiler halkı şok etti
common_voice_tr_18351845.wav,121388,aktör on iki mart çarşamba günü kanserden ölmüştü
common_voice_tr_18351825.wav,94508,bu süreçle ilgili fikriniz nedir
common_voice_tr_18351857.wav,103724,avro olmadan ülke parçalanır
common_voice_tr_18351859.wav,113708,bunun etkileri ise şüphesiz oldukça çarpıcı oldu
common_voice_tr_18351843.wav,109868,fakat müşteriler durumdan memnun görünüyorlar
common_voice_tr_18351846.wav,96044,kötü haberse devlet finansmanı
common_voice_tr_18351860.wav,88364,brkiç'e göre rekabet artıyor
common_voice_tr_18351858.wav,113708,eşi oğlu ve torunuysa ağır yaralandı
common_voice_tr_18351881.wav,178988,güney sırbistan'da ülkenin geri kalanına kıyasla daha fazla basın özgürlüğü mü var
common_voice_tr_18351908.wav,76844,bir kişi serbest bırakıldı
common_voice_tr_18351894.wav,119084,kosteliç'in madalya umudu mahvolmuş görünüyordu
common_voice_tr_18351911.wav,80684,geleceği tahmin etmek zor
common_voice_tr_18351907.wav,98348,arnavutluk'ta ihracat zayıf
common_voice_tr_18351909.wav,90668,çiftçiler en başta iyimserdiler
common_voice_tr_17415315.wav,209708,söz konusu kişilerin eskiden yaşadıkları yerlerin güvenliği konusunda bize ne söyleyebilirsiniz
common_voice_tr_17415336.wav,103724,çift saraybosna'dan karadağ'a geçti
common_voice_tr_17415314.wav,117548,halkın yaklaşık yüzde otuz üçü oy kullanmayacak
common_voice_tr_17415312.wav,149804,operasyonda üç işadamı da gözaltına alındı
common_voice_tr_17415340.wav,113708,plamadeala iki bin beş yılında öldü
common_voice_tr_17415347.wav,119084,tarihi binalar köprüler ve kaleler var
common_voice_tr_17415348.wav,82988,onlar şanslı olanlar
common_voice_tr_17443710.wav,126764,taslak onay için parlamentoya gönderilecek
common_voice_tr_17443719.wav,71468,ama yapamaz
common_voice_tr_17443732.wav,94508,eşyalara soruşturmanın devamı için el kondu
common_voice_tr_17443716.wav,82988,karadağ da burada bir şans görüyor
common_voice_tr_17443736.wav,161324,televizyondaki her dört sözcükten birisi kriz
common_voice_tr_17443739.wav,103724,toprak kaymaları da oldukça sık yaşanıyor
common_voice_tr_17443737.wav,113708,bu itirazlar dışında hükümet başarısından emin
common_voice_tr_17443742.wav,228908,anayasaya göre arnavutluk'un resmi bir dini yok
common_voice_tr_17443743.wav,142124,ancak bu oldukça engebeli bir yol
common_voice_tr_17443745.wav,126764,si bu kararıyla iddiayı kaybetmiş göründü
common_voice_tr_17443741.wav,117548,ancak bu sorun da çözülüyor
common_voice_tr_17443747.wav,163628,burada da madrid'te olduğu gibi kamuoyunun görüşünün değişmesini mi bekliyorlardı
common_voice_tr_17443763.wav,142124,ancak lefkoşe öneriyi kesin bir dille reddetti
common_voice_tr_17443767.wav,92204,bu yasayı yeni bir özel birim uygulayacak
common_voice_tr_17443768.wav,84524,ancak tek faktör bu değil
common_voice_tr_17443772.wav,94508,hükümet sorunla baş etmek için adımlar atıyor
common_voice_tr_17443769.wav,92204,bu rakamlar belirgin şekilde artabilir
common_voice_tr_17443775.wav,80684,bunların on milyon avroluk bir bütçeleri var
common_voice_tr_17443774.wav,115244,bazılarına ilgi diğerlerine göre daha büyük
common_voice_tr_17443785.wav,73004,halka her şeyi açıklayacağız
common_voice_tr_17443777.wav,115244,ancak bu işbirliğinin kolay olmadığı görüldü
common_voice_tr_17443784.wav,59948,on iki ülke henüz tanımadı
common_voice_tr_17443773.wav,167468,sırbistan kosova tarafından verilen araç plakalarını ve evrakları tanıyacak mı
common_voice_tr_17443788.wav,56108,bunlar savaş suçluları
common_voice_tr_17443790.wav,102188,babasının yokluğunda yusuf konuşmayı bırakıyor
common_voice_tr_17443793.wav,90668,yarışmayı çinli bir öğrenci kazandı
common_voice_tr_17443794.wav,80684,sergi ocak ayına kadar devam edecek
common_voice_tr_17443800.wav,107564,karşılıklı olarak bayram tebrikleri ediliyor
common_voice_tr_17443801.wav,107564,bu görevlerin çoğu tehlikeli kabul edilmiyor
common_voice_tr_17443804.wav,99884,bizim politikamız budur
common_voice_tr_17443805.wav,107564,hırsızlar hazır olmayacak bir fidye yolu arıyor
common_voice_tr_17443806.wav,98348,daha sonra bu kişi yemek masasını hazırlar
common_voice_tr_17443814.wav,69164,ancak zorluklar da yok değil
common_voice_tr_17443811.wav,140588,toplam yatırım bedeli altı virgül beş milyon avroya ulaştı
common_voice_tr_17443809.wav,107564,adaylık ocak ayı sonunda sunulacak
common_voice_tr_17443816.wav,80684,oysa işler pek de öyle değil
common_voice_tr_17443820.wav,96044,planı yalnızca on dört vekil destekledi
common_voice_tr_17443829.wav,99884,doğrudan ya da dolaylı olarak hepimizi etkiliyor
common_voice_tr_17443832.wav,90668,bu hiç de haksız bir heveslilik değil
common_voice_tr_17460345.wav,107564,bu harika bir kaçış mekanizması da olur
common_voice_tr_21172895.wav,159788,filmin tiran'daki galası bu ay gerçekleşecek
common_voice_tr_21172901.wav,169004,kosteliç'in madalya umudu mahvolmuş görünüyordu
common_voice_tr_21172921.wav,159788,şeffaflık eksikliği bunu anlamayı zorlaştırıyor
common_voice_tr_21172900.wav,155948,sırbistan'ın organ donörlerine ihtiyacı var
common_voice_tr_21172918.wav,117548,birlikte iki çocukları olmuş
common_voice_tr_21172920.wav,134444,ayin on beş dile tercüme edildi
common_voice_tr_21172965.wav,107564,bana hiçbir yeni öneri getirilmedi
common_voice_tr_21173002.wav,148268,belgrad'ın bu konudaki görüşü ise tamamen farklı
common_voice_tr_21172973.wav,186668,reformlar türkiye'deki siyasi bölünmeden sağ kurtulabilir mi
common_voice_tr_21173007.wav,130604,proje tamamlandığında bu durum da değişecek
common_voice_tr_21173074.wav,98348,rakamlar kaynağa göre değişiyor
common_voice_tr_21173081.wav,115244,türk medyası da yasağa ateş püskürdü
common_voice_tr_21173091.wav,92204,burada tam olarak ne oldu
common_voice_tr_21173121.wav,155948,proje yaklaşık iki yüz bin avroya mal olacak
common_voice_tr_21173119.wav,129068,sokaktaysa vatandaş sonuç bekliyor
common_voice_tr_21173130.wav,106028,lise aşkını bulmayı başardı
common_voice_tr_21173127.wav,132908,kurul salı günü tekrar toplanma kararı aldı
common_voice_tr_21173205.wav,106028,üst yönetim seviyesinde fark daha da büyük
common_voice_tr_21197512.wav,178988,mali af akıllıca bir kamu politikası mı yoksa seçim oyunu mu
common_voice_tr_21197487.wav,144428,belgenin bir ay içinde imzalanması bekleniyor
common_voice_tr_21197490.wav,149804,milletvekili dokunulmazlığı yirmi dört saattir
common_voice_tr_21173213.wav,94508,bu avrupa'ya uzanan bir yol
common_voice_tr_21197593.wav,115244,sc parlamentosunda da durum böyle
common_voice_tr_21197591.wav,107564,bazı tanıklar ifade vermeyi reddetti
common_voice_tr_21197606.wav,186668,kısır döngüleri ve az gelişmişlik tuzaklarını kırmak neden bu kadar zor
common_voice_tr_21197610.wav,132908,herşeyi barışçıl yollardan çözerdi
common_voice_tr_21197592.wav,107564,bu rakamlar belirgin şekilde artabilir
common_voice_tr_21197617.wav,126764,altyapıda pek çok iyileştirme yapılması gerekir
common_voice_tr_21197608.wav,125228,burada dikkati çeken ilk şey mimari
common_voice_tr_21197623.wav,86828,ama onlar bunu yapmadı
common_voice_tr_21197651.wav,136748,numara değiştirme hizmeti ekim ayında başlamıştı
common_voice_tr_21197653.wav,115244,ancak bu bakanın hoşuna gitmedi
common_voice_tr_21197652.wav,136748,benedikt ile yaptığı görüşme sonrasında geldi
common_voice_tr_21197671.wav,125228,o yüzden de bazen keşke o olabilseydim diyorum
common_voice_tr_21197672.wav,129068,yaklaşık kırk milyon seçmen sandık başına gitti
common_voice_tr_21197681.wav,129068,kentin sokakları iki metre su altında kaldı
common_voice_tr_21197673.wav,145964,bize bir amerikan birliğiymişiz gibi davranıyorlar
common_voice_tr_21197683.wav,102188,bu bir kalite meselesi
common_voice_tr_21197690.wav,241964,sizce sırp ekonomisi en büyük sıkıntıyı yılın hangi döneminde yaşayacak ve neden
common_voice_tr_21197682.wav,138284,gruevski de benzer umutlarını dile getirdi
common_voice_tr_21235385.wav,121388,yoksa sadece bir mutlak iyimser miyim
common_voice_tr_21235386.wav,117548,ankete toplam bin yüz on beş kişi katıldı
common_voice_tr_21235343.wav,178988,muhalefet partileri hükümete karşı ciddi bir mücadele ortaya koyabiliyorlar mı
common_voice_tr_21235349.wav,138284,ancak bu olumlu durum kısa sürede tersine dondu
common_voice_tr_21235398.wav,126764,şimdiyse bu rakam yirmi bin kadar arttı
common_voice_tr_21235494.wav,140588,kosova'nın tanınma sürecinde yavaşlama mı yaşanıyor
common_voice_tr_21235509.wav,117548,olayların failleri bulunamadı
common_voice_tr_17910980.wav,107564,kampanya haziran iki bin ona kadar devam edecek
common_voice_tr_17910981.wav,96044,gerçekten de bu süreci hızlandırmak istiyoruz
common_voice_tr_17910982.wav,59948,diğer iki kişi bosnalı
common_voice_tr_21235529.wav,144428,her iki toplumdan da sakin olmalarını istiyoruz
common_voice_tr_17910998.wav,102188,sendikalar bir dizi grev yapılacağını duyurdu
common_voice_tr_17910999.wav,99884,bu aşamaya gelebilen dava sayısı zaten çok az
common_voice_tr_17911000.wav,84524,yine de reform çığlıkları giderek büyüdü
common_voice_tr_17911017.wav,161324,bölgede geleceğe yönelik özelleştirme çalışmaları açısından daha neler yapılması gerekiyor
common_voice_tr_17911018.wav,84524,bu kıta büyük özverilerin bir ürünüdür
common_voice_tr_17911024.wav,98348,festival yirmi iki eylül'e kadar devam edecek
common_voice_tr_17911025.wav,71468,bunun hakkında ne düşünüyorsunuz
common_voice_tr_17911023.wav,98348,su parkı da iki bin altı yılında açıldı
common_voice_tr_17911063.wav,88364,hırvat liderler de bunu kabul ettiler
common_voice_tr_17911078.wav,98348,bize bir amerikan birliğiymişiz gibi davranıyorlar
common_voice_tr_17911080.wav,82988,bazı tanıklar ifade vermeyi reddetti
common_voice_tr_17911104.wav,115244,ama önce partinin seçimleri kazanması gerekiyor
common_voice_tr_17911102.wav,80684,türk liderleri saldırıyı kınadılar
common_voice_tr_17911115.wav,88364,temyiz süreci şu anda devam ediyor
common_voice_tr_17911114.wav,103724,tüketici kredisi de bu konuda rol oynadı
common_voice_tr_17911117.wav,117548,romanya nokia aksesuar fabrikasına kavuştu
